Cites,Authors,Title,Year,Source,Publisher,ArticleURL,CitesURL,GSRank,QueryDate,Type,DOI,ISSN,CitationURL,Volume,Issue,StartPage,EndPage,ECC,CitesPerYear,CitesPerAuthor,AuthorCount,Age,Abstract,FullTextURL,RelatedURL
0,"A Tripathi","Print Technique and Material Modification In 3D Printing of Concrete",2024,"","search.proquest.com","https://search.proquest.com/openview/bd5c62a09944b37f90d5625e3fe7e6d7/1?pq-origsite=gscholar&cbl=18750&diss=y","",180,"2026-01-26 18:10:31","HTML","","",,,,,,0,0.00,0,1,2,"… responses in printed products, and offer insights into cost-effective and environmentally efficient section design through composite material printing using 3D concrete printing. …","https://search.proquest.com/openview/bd5c62a09944b37f90d5625e3fe7e6d7/1?pq-origsite=gscholar&cbl=18750&diss=y","https://scholar.google.com/scholar?q=related:rndLQwmKVEEJ:scholar.google.com/&scioq=%223d+concrete+printing%22+%22path+planning%22+%22robot%22&hl=en&as_sdt=2007&as_ylo=2020&as_yhi=2026"
3,"PL Rosendahl, A Wolf","The business case for 3D printing in the built environment",2022,"Structures and Architecture. A Viable …","taylorfrancis.com","https://www.taylorfrancis.com/chapters/edit/10.1201/9781003023555-31/business-case-3d-printing-built-environment-rosendahl-wolf","https://scholar.google.com/scholar?cites=14936069208901398320&as_sdt=2005&sciodt=2007&hl=en",181,"2026-01-26 18:10:31","","10.1201/9781003023555-31/business-case-3d-printing-built-environment-rosendahl-wolf","",,,,,,3,0.75,2,2,4,"… Investigated the industrial potential of the technology using a 6-axis robot arm and a selfdeveloped conveyor system for the clay mass (Figure 3, top left). They demonstrated the …","","https://scholar.google.com/scholar?q=related:MK83kc-TR88J:scholar.google.com/&scioq=%223d+concrete+printing%22+%22path+planning%22+%22robot%22&hl=en&as_sdt=2007&as_ylo=2020&as_yhi=2026"
20,"M Leschok, L Reiter, B Dillenburger","Large-scale hollow-core 3D printing (HC3DP): A polymer 3D printing technology for large-scale ultralightweight components",2023,"Additive Manufacturing","Elsevier","https://www.sciencedirect.com/science/article/pii/S2214860423004876","https://scholar.google.com/scholar?cites=13883597017790939454&as_sdt=2005&sciodt=2007&hl=en",182,"2026-01-26 18:10:31","HTML","","",,,,,,20,6.67,7,3,3,"Material extrusion (ME) has become a popular 3D printing method for large-scale applications such as in the automotive, naval, aerospace, and architecture sectors. It allows the …","https://www.sciencedirect.com/science/article/pii/S2214860423004876","https://scholar.google.com/scholar?q=related:PgEa4u1xrMAJ:scholar.google.com/&scioq=%223d+concrete+printing%22+%22path+planning%22+%22robot%22&hl=en&as_sdt=2007&as_ylo=2020&as_yhi=2026"
4,"SM Mei, ZW Li, BG He, JQ Song, MY Zhang…","A Novel Large-Scale 3D Printing Apparatus for Complex Geological Models and Its Application",2025,"Rock Mechanics and …","Springer","https://link.springer.com/article/10.1007/s00603-025-04598-2","https://scholar.google.com/scholar?cites=11721888615032751692&as_sdt=2005&sciodt=2007&hl=en",183,"2026-01-26 18:10:31","HTML","10.1007/s00603-025-04598-2","",,,,,,4,4.00,1,6,1,"… Next, the digital models of each zone were imported into 3D printing control software for layer slicing and path planning. For the intact rock mass zones, the printing path presented an …","https://link.springer.com/article/10.1007/s00603-025-04598-2","https://scholar.google.com/scholar?q=related:TAa5E5eDrKIJ:scholar.google.com/&scioq=%223d+concrete+printing%22+%22path+planning%22+%22robot%22&hl=en&as_sdt=2007&as_ylo=2020&as_yhi=2026"
15,"R Oval, E Costa, M Nuh…","A path towards off-site automated fabrication of segmented concrete shells as building floors",2020,"Proceedings of IASS …","ingentaconnect.com","https://www.ingentaconnect.com/content/iass/piass/2020/00002020/00000001/art00003","https://scholar.google.com/scholar?cites=5187220023567591875&as_sdt=2005&sciodt=2007&hl=en",184,"2026-01-26 18:10:31","","","",,,,,,15,2.50,4,4,6,"… movement needed from the robot and solves reach problems … model, and materialisation and path planning of the robotic … Assessing the environmental viability of 3D concrete printing …","https://uwe-repository.worktribe.com/index.php/preview/13612162/s3.pdf","https://scholar.google.com/scholar?q=related:wymK3CC1_EcJ:scholar.google.com/&scioq=%223d+concrete+printing%22+%22path+planning%22+%22robot%22&hl=en&as_sdt=2007&as_ylo=2020&as_yhi=2026"
2,"I Gajdoš, Ł Sobaszek, P Štefčák, J Varga, J Slota","A novel parametrical approach to the ribbed element slicing process in robotic additive manufacturing",2025,"Polymers","mdpi.com","https://www.mdpi.com/2073-4360/17/14/1965","https://scholar.google.com/scholar?cites=3732500984922772916&as_sdt=2005&sciodt=2007&hl=en",185,"2026-01-26 18:10:31","HTML","","",,,,,,2,2.00,0,5,1,"… on an ABB robot in the FFF process. An algorithm for non-planar path planning with variable … [16] describes a solution in which a robot’s end effector travels along the toolpath modeled …","https://www.mdpi.com/2073-4360/17/14/1965","https://scholar.google.com/scholar?q=related:tBUewt6BzDMJ:scholar.google.com/&scioq=%223d+concrete+printing%22+%22path+planning%22+%22robot%22&hl=en&as_sdt=2007&as_ylo=2020&as_yhi=2026"
9,"EO Kurniati, HJ Kim","Utilizing Industrial By-Products for Sustainable Three-Dimensional-Printed Infrastructure Applications: A Comprehensive Review",2023,"Infrastructures","mdpi.com","https://www.mdpi.com/2412-3811/8/10/140","https://scholar.google.com/scholar?cites=897692460745107055&as_sdt=2005&sciodt=2007&hl=en",186,"2026-01-26 18:10:31","HTML","","",,,,,,9,3.00,5,2,3,"… the printed layers in 3D concrete printing, some methods to … by combining computer vision, a path planning algorithm, and 3D … In addition, a flying 3D printing robot that was inspired by …","https://www.mdpi.com/2412-3811/8/10/140","https://scholar.google.com/scholar?q=related:byZCcIk-dQwJ:scholar.google.com/&scioq=%223d+concrete+printing%22+%22path+planning%22+%22robot%22&hl=en&as_sdt=2007&as_ylo=2020&as_yhi=2026"
17,"SA Prieto, N Giakoumidis…","AutoCIS: an automated construction inspection system for quality inspection of buildings",2021,"ISARC. Proceedings of the …","researchgate.net","https://www.researchgate.net/profile/Samuel_Prieto2/publication/355875485_AutoCIS_An_Automated_Construction_Inspection_System_for_Quality_Inspection_of_Buildings/links/618278f03c987366c31dd438/AutoCIS-An-Automated-Construction-Inspection-System-for-Quality-Inspection-of-Buildings.pdf","https://scholar.google.com/scholar?cites=17334068562173631617&as_sdt=2005&sciodt=2007&hl=en",187,"2026-01-26 18:10:31","PDF","","",,,,,,17,3.40,6,3,5,"… based on a multi-robot system that works synergistically to … , block placing, or 3D concrete printing coordination [6]–[8]. Most … for indoor positioning and autonomous path planning [29]. In …","https://www.researchgate.net/profile/Samuel_Prieto2/publication/355875485_AutoCIS_An_Automated_Construction_Inspection_System_for_Quality_Inspection_of_Buildings/links/618278f03c987366c31dd438/AutoCIS-An-Automated-Construction-Inspection-System-for-Quality-Inspection-of-Buildings.pdf","https://scholar.google.com/scholar?q=related:gRygeIT7jvAJ:scholar.google.com/&scioq=%223d+concrete+printing%22+%22path+planning%22+%22robot%22&hl=en&as_sdt=2007&as_ylo=2020&as_yhi=2026"
4,"H Huang, C Brosque, A Tono, A Agrawal…","Exploring a design for robotic construction approach: two case studies matching robot and construction design features",2023,"EC3 Conference 2023","ec-3.org","https://ec-3.org/publications/conference/paper/?id=EC32023_202","https://scholar.google.com/scholar?cites=1997566780630270976&as_sdt=2005&sciodt=2007&hl=en",188,"2026-01-26 18:10:31","","","",,,,,,4,1.33,1,5,3,"… what is accessible by the robot, and suggest redesigning the robot to improve its ability to access locations. In terms of physical metrics, the robot needs a certain degree of accessibility …","https://ec-3.org/publications/conferences/EC32023/papers/EC32023_202.pdf","https://scholar.google.com/scholar?q=related:AISWRmfIuBsJ:scholar.google.com/&scioq=%223d+concrete+printing%22+%22path+planning%22+%22robot%22&hl=en&as_sdt=2007&as_ylo=2020&as_yhi=2026"
0,"S Ghungrad, A Haghighi","Stress Analysis in Multi-head Large Scale Additive Manufacturing",2024,"IISE Annual Conference …","search.proquest.com","https://search.proquest.com/openview/4e22ba67e36face82c39d24f37c04950/1?pq-origsite=gscholar&cbl=51908","",189,"2026-01-26 18:10:31","HTML","","",,,,,,0,0.00,0,2,2,"… answered for multi-robot AM, which include the path planning and … the characteristics of tool path planning for single head in … : potentials and challenges of 3D concrete printing.” Virtual …","https://search.proquest.com/openview/4e22ba67e36face82c39d24f37c04950/1?pq-origsite=gscholar&cbl=51908","https://scholar.google.com/scholar?q=related:uCRUcwAvP6AJ:scholar.google.com/&scioq=%223d+concrete+printing%22+%22path+planning%22+%22robot%22&hl=en&as_sdt=2007&as_ylo=2020&as_yhi=2026"
10,"YF Kaya, L Orr, BB Kocer, V Pawar, R Stuart-Smith…","Aerial additive manufacturing: Toward on-site building construction with aerial robots",2025,"Science Robotics","science.org","https://www.science.org/doi/abs/10.1126/scirobotics.ado6251","https://scholar.google.com/scholar?cites=12677132453969150323&as_sdt=2005&sciodt=2007&hl=en",190,"2026-01-26 18:10:31","","10.1126/scirobotics.ado6251","",,,,,,10,10.00,2,6,1,"… robot enabled fabrication at a larger scale by carrying the rope between the two articulated robot… , adaptive trajectory path planning, or multirobot self-organization by multiagent …","https://discovery.ucl.ac.uk/id/eprint/10208790/1/Aerial%20AM%20Review%20Paper%20accepted%20version.pdf","https://scholar.google.com/scholar?q=related:c0Fo8cw47q8J:scholar.google.com/&scioq=%223d+concrete+printing%22+%22path+planning%22+%22robot%22&hl=en&as_sdt=2007&as_ylo=2020&as_yhi=2026"
16,"F Insero, V Furlan, H Giberti","Non-planar slicing for filled free-form geometries in robot-based FDM",2025,"Journal of Intelligent Manufacturing","Springer","https://link.springer.com/article/10.1007/s10845-023-02250-w","https://scholar.google.com/scholar?cites=9227258141946857987&as_sdt=2005&sciodt=2007&hl=en",191,"2026-01-26 18:10:31","HTML","10.1007/s10845-023-02250-w","",,,,,,16,16.00,5,3,1,"… The robot controller uses 3 RAPID task: i) T_ROB manages the robot motion and receiving … , iii) T_PAR is involved for collecting robot information during the prints. The T_ROB task …","https://link.springer.com/article/10.1007/s10845-023-02250-w","https://scholar.google.com/scholar?q=related:A8qSWWTODYAJ:scholar.google.com/&scioq=%223d+concrete+printing%22+%22path+planning%22+%22robot%22&hl=en&as_sdt=2007&as_ylo=2020&as_yhi=2026"
0,"L Lu, Y Yang, K Sheng, X Du, Y Song, Z Mi","Green design and manufacturing processes based on additive manufacturing: A review",2025,"MRS Communications","Springer","https://link.springer.com/article/10.1557/s43579-025-00789-8","",192,"2026-01-26 18:10:31","HTML","10.1557/s43579-025-00789-8","",,,,,,0,0.00,0,6,1,"… , and resource-conscious path planning to eliminate unnecessary material deposition. … integrated with a multi-degree-of-freedom robot in order to avoid additional load bearing to enable …","https://link.springer.com/article/10.1557/s43579-025-00789-8","https://scholar.google.com/scholar?q=related:QKxVVQWaUGIJ:scholar.google.com/&scioq=%223d+concrete+printing%22+%22path+planning%22+%22robot%22&hl=en&as_sdt=2007&as_ylo=2020&as_yhi=2026"
737,"GD Goh, SL Sing, WY Yeong","A review on machine learning in 3D printing: applications, potential, and challenges",2021,"Artificial Intelligence Review","Springer","https://link.springer.com/article/10.1007/s10462-020-09876-9","https://scholar.google.com/scholar?cites=3262716162361058054&as_sdt=2005&sciodt=2007&hl=en",193,"2026-01-26 18:10:31","","10.1007/s10462-020-09876-9","",,,,,,737,147.40,246,3,5,"… some other aspects related to the efficiency of the design and manufacturing process for 3D printing techniques, namely, printability checking, slicing acceleration, nozzle path planning, …","https://dr.ntu.edu.sg/bitstreams/0eb6c473-0009-4e29-a5be-71ca316435e6/download","https://scholar.google.com/scholar?q=related:BuN0JBB_Ry0J:scholar.google.com/&scioq=%223d+concrete+printing%22+%22path+planning%22+%22robot%22&hl=en&as_sdt=2007&as_ylo=2020&as_yhi=2026"
3,"P Eversmann, A Rossi","Towards construction 4.0: computational circular design and additive manufacturing for architecture through robotic fabrication with sustainable materials and open …",2023,"Architecture and Design for Industry 4.0: Theory …","Springer","https://link.springer.com/chapter/10.1007/978-3-031-36922-3_17","https://scholar.google.com/scholar?cites=16936195973979501139&as_sdt=2005&sciodt=2007&hl=en",194,"2026-01-26 18:10:31","","10.1007/978-3-031-36922-3_17","",,,,,,3,1.00,2,2,3,"… of new robot systems is mainly done using the Robot Operating System (ROS) for programming, path planning and direct robot … Here, it is also possible to use automated path planning …","https://www.researchgate.net/profile/Philipp-Eversmann/publication/374477786_Towards_Construction_40_Computational_Circular_Design_and_Additive_Manufacturing_for_Architecture_Through_Robotic_Fabrication_with_Sustainable_Materials_and_Open-Source_Tools/links/651fd0e4fc5c2a0c3bb8fe7d/Towards-Construction-40-Computational-Circular-Design-and-Additive-Manufacturing-for-Architecture-Through-Robotic-Fabrication-with-Sustainable-Materials-and-Open-Source-Tools.pdf","https://scholar.google.com/scholar?q=related:U_Jyq4F0CesJ:scholar.google.com/&scioq=%223d+concrete+printing%22+%22path+planning%22+%22robot%22&hl=en&as_sdt=2007&as_ylo=2020&as_yhi=2026"
2,"P Rennen, S Gantner, T Rothe, B Baz, S Nana…","Structural Evaluation of Shotcrete 3D Printing and Robotic Fiber Winding for Thin Shell Elements",2024,"","researchgate.net","https://www.researchgate.net/profile/Philipp-Rennen/publication/392663342_Structural_Evaluation_of_Shotcrete_3D_Printing_and_Robotic_Fiber_Winding_for_Thin_Shell_Elements/links/684c82b324267473b776d5a4/Structural-Evaluation-of-Shotcrete-3D-Printing-and-Robotic-Fiber-Winding-for-Thin-Shell-Elements.pdf","https://scholar.google.com/scholar?cites=18370701498271765706&as_sdt=2005&sciodt=2007&hl=en",195,"2026-01-26 18:10:31","PDF","","",,,,,,2,1.00,0,6,2,"… manufacturing and especially 3D Concrete Printing (3DCP), … Despite the meander shift logic in path planning, which … data to regulate nozzle spacing and robot feed rate could lead to …","https://www.researchgate.net/profile/Philipp-Rennen/publication/392663342_Structural_Evaluation_of_Shotcrete_3D_Printing_and_Robotic_Fiber_Winding_for_Thin_Shell_Elements/links/684c82b324267473b776d5a4/Structural-Evaluation-of-Shotcrete-3D-Printing-and-Robotic-Fiber-Winding-for-Thin-Shell-Elements.pdf","https://scholar.google.com/scholar?q=related:ypQ5N67X8f4J:scholar.google.com/&scioq=%223d+concrete+printing%22+%22path+planning%22+%22robot%22&hl=en&as_sdt=2007&as_ylo=2020&as_yhi=2026"
0,"S Joseph","Tornado-Resilient 3D-Printed Housing: A US Case Study Validating Cost-Effective Construction with Conventional Mortar",2025,"Available at SSRN 5325985","papers.ssrn.com","https://papers.ssrn.com/sol3/papers.cfm?abstract_id=5325985","",196,"2026-01-26 18:10:31","","","",,,,,,0,0.00,0,1,1,"… Global interest in 3D concrete Printing (3DCP) has grown exponentially as the construction … The system’s path planning algorithm automatically selected corners as start points for each …","https://papers.ssrn.com/sol3/Delivery.cfm?abstractid=5325985","https://scholar.google.com/scholar?q=related:ls2Kd7fKWkIJ:scholar.google.com/&scioq=%223d+concrete+printing%22+%22path+planning%22+%22robot%22&hl=en&as_sdt=2007&as_ylo=2020&as_yhi=2026"
0,"L Bettermann, M Slepicka, S Esser, A Borrmann","Data-driven parameter calibration in additive manufacturing for construction: an introduction to learning by printing",2025,"","strathprints.strath.ac.uk","https://strathprints.strath.ac.uk/93249/","",197,"2026-01-26 18:10:31","","","",,,,,,0,0.00,0,4,1,"… AM methods, such as extrusion-based 3D Concrete Printing, … steps like object slicing, path planning and task scheduling are … trajectories into sequences of robot poses, accounting for …","https://strathprints.strath.ac.uk/93249/7/Bettermann-etal-EG-ICE-2025-Data-driven-parameter-calibration-in-additive-manufacturing-for-construction.pdf","https://scholar.google.com/scholar?q=related:t1APNbB82soJ:scholar.google.com/&scioq=%223d+concrete+printing%22+%22path+planning%22+%22robot%22&hl=en&as_sdt=2007&as_ylo=2020&as_yhi=2026"
239,"CJ Liang, X Wang, VR Kamat…","Human–robot collaboration in construction: Classification and research trends",2021,"Journal of Construction …","ascelibrary.org","https://ascelibrary.org/doi/full/10.1061/(ASCE)CO.1943-7862.0002154","https://scholar.google.com/scholar?cites=10800724287416806725&as_sdt=2005&sciodt=2007&hl=en",198,"2026-01-26 18:10:31","HTML","10.1061/(ASCE)CO.1943-7862.0002154","",,,,,,239,47.80,60,4,5,"… Such point clouds can be used for as-built 3D model updating or robot path planning. Since the UAV requires batteries and has limited operating time, it is important to maximize the …","https://ascelibrary.org/doi/full/10.1061/(ASCE)CO.1943-7862.0002154","https://scholar.google.com/scholar?q=related:Ra1pxIPh45UJ:scholar.google.com/&scioq=%223d+concrete+printing%22+%22path+planning%22+%22robot%22&hl=en&as_sdt=2007&as_ylo=2020&as_yhi=2026"
12,"A Al Masri, BBF da Costa, D Vasco, D Boer…","Roles of robotics in architectural and engineering construction industries: review and future trends",2024,"Journal of Building …","sciexplor.com","https://www.sciexplor.com/articles/2811-0730-0302-9","https://scholar.google.com/scholar?cites=14823738271653367749&as_sdt=2005&sciodt=2007&hl=en",199,"2026-01-26 18:10:31","HTML","","",,,,,,12,6.00,2,5,2,"… indoor path planning framework for unmanned ground robots. It integrates robot information … this framework in addressing indoor path planning challenges for unmanned ground robots. …","https://www.sciexplor.com/articles/2811-0730-0302-9","https://scholar.google.com/scholar?q=related:xQ9DJWt_uM0J:scholar.google.com/&scioq=%223d+concrete+printing%22+%22path+planning%22+%22robot%22&hl=en&as_sdt=2007&as_ylo=2020&as_yhi=2026"
177,"SSL Chan, RM Pennings, L Edwards, GV Franks","3D printing of clay for decorative architectural applications: Effect of solids volume fraction on rheology and printability",2020,"Additive Manufacturing","Elsevier","https://www.sciencedirect.com/science/article/pii/S2214860420307077","https://scholar.google.com/scholar?cites=1434302444542862578&as_sdt=2005&sciodt=2007&hl=en",200,"2026-01-26 18:10:31","HTML","","",,,,,,177,29.50,44,4,6,"The effect of varying the solids volume fraction of an aqueous clay paste suspension on its printability via an Additive Manufacturing (AM) or 3D printing technique, Direct Ink Writing (…","https://www.sciencedirect.com/science/article/pii/S2214860420307077","https://scholar.google.com/scholar?q=related:8qRzW3mq5xMJ:scholar.google.com/&scioq=%223d+concrete+printing%22+%22path+planning%22+%22robot%22&hl=en&as_sdt=2007&as_ylo=2020&as_yhi=2026"
5,"R Garcia-Alvarado, P Soza-Ruiz…","Development of a generative design system for 3D-printed houses in Chile",2024,"Buildings","mdpi.com","https://www.mdpi.com/2075-5309/14/9/2939","https://scholar.google.com/scholar?cites=8012078186317986278&as_sdt=2005&sciodt=2007&hl=en",201,"2026-01-26 18:10:31","HTML","","",,,,,,5,2.50,2,3,2,"… Perimeter path planning for the walls was carried out, with interior segments to contain the columns and recesses for the upper tie. The walls were printed in sections in the laboratory, …","https://www.mdpi.com/2075-5309/14/9/2939","https://scholar.google.com/scholar?q=related:5rkjIKmeMG8J:scholar.google.com/&scioq=%223d+concrete+printing%22+%22path+planning%22+%22robot%22&hl=en&as_sdt=2007&as_ylo=2020&as_yhi=2026"
0,"KS Chinogureyi","Investigating the performance of Larox filter cake integration in 3D concrete printing",2023,"","search.proquest.com","https://search.proquest.com/openview/3b2779663ed80192737f2f4b0dc3c76e/1?pq-origsite=gscholar&cbl=2026366&diss=y","",202,"2026-01-26 18:10:31","BOOK","","",,,,,,0,0.00,0,1,3,"The construction sector is undergoing a paradigm change towards sustainability and innovation, with 3D Mortar Printing (3DCP) emerging as an exciting new technology. This research …","https://search.proquest.com/openview/3b2779663ed80192737f2f4b0dc3c76e/1?pq-origsite=gscholar&cbl=2026366&diss=y","https://scholar.google.com/scholar?q=related:vbPqWnyyZPsJ:scholar.google.com/&scioq=%223d+concrete+printing%22+%22path+planning%22+%22robot%22&hl=en&as_sdt=2007&as_ylo=2020&as_yhi=2026"
119,"J Kechagias, S Zaoutsos","Effects of 3D-printing processing parameters on FFF parts' porosity: Outlook and trends",2024,"Materials and Manufacturing Processes","Taylor &Francis","https://www.tandfonline.com/doi/abs/10.1080/10426914.2024.2304843","https://scholar.google.com/scholar?cites=13463849308908857473&as_sdt=2005&sciodt=2007&hl=en",203,"2026-01-26 18:10:31","","10.1080/10426914.2024.2304843","",,,,,,119,59.50,60,2,2,"… Moreover, structural parameters of 3D printing, like the infill type and the part size, affect the thermal history, making topology and path planning optimization vital for better mechanical …","https://www.tandfonline.com/doi/pdf/10.1080/10426914.2024.2304843","https://scholar.google.com/scholar?q=related:gajmppwz2boJ:scholar.google.com/&scioq=%223d+concrete+printing%22+%22path+planning%22+%22robot%22&hl=en&as_sdt=2007&as_ylo=2020&as_yhi=2026"
2,"P Fucile, VC David, M Kalogeropoulou…","RAVEN: development of a novel robotic additive manufacturing system towards small-scale fabrication of complex scaffolds for regenerative medicine",2024,"Virtual and Physical …","Taylor &Francis","https://www.tandfonline.com/doi/abs/10.1080/17452759.2024.2410412","https://scholar.google.com/scholar?cites=8619270065773952517&as_sdt=2005&sciodt=2007&hl=en",204,"2026-01-26 18:10:31","","10.1080/17452759.2024.2410412","",,,,,,2,1.00,1,4,2,"… in which the ability of the robot to change its configuration while printing will be crucial. … The path planning system was optimised in order to improve its efficiency. A complex trajectory …","https://www.tandfonline.com/doi/pdf/10.1080/17452759.2024.2410412","https://scholar.google.com/scholar?q=related:BT6dPXXMnXcJ:scholar.google.com/&scioq=%223d+concrete+printing%22+%22path+planning%22+%22robot%22&hl=en&as_sdt=2007&as_ylo=2020&as_yhi=2026"
14,"T Pastore, C Menna, D Asprone","Bézier-based biased random-key genetic algorithm to address printability constraints in the topology optimization of concrete structures",2022,"Structural and Multidisciplinary …","Springer","https://link.springer.com/article/10.1007/s00158-021-03119-3","https://scholar.google.com/scholar?cites=16175455728176627629&as_sdt=2005&sciodt=2007&hl=en",205,"2026-01-26 18:10:31","HTML","10.1007/s00158-021-03119-3","",,,,,,14,3.50,5,3,4,"… Similarly, a concurrent programming of path planning and compliance optimization is discussed by Liu and Yu (2017), extending the well-established level set framework. …","https://link.springer.com/article/10.1007/s00158-021-03119-3","https://scholar.google.com/scholar?q=related:rX8GlkjDeuAJ:scholar.google.com/&scioq=%223d+concrete+printing%22+%22path+planning%22+%22robot%22&hl=en&as_sdt=2007&as_ylo=2020&as_yhi=2026"
4,"S Goka, SN Srirama, G Divya Jyothi…","Welding‐Based 3D, 4D, 5D Printing",2024,"… in welding industry …","Wiley Online Library","https://onlinelibrary.wiley.com/doi/abs/10.1002/9781394172948.ch10","https://scholar.google.com/scholar?cites=8101304941085021499&as_sdt=2005&sciodt=2007&hl=en",206,"2026-01-26 18:10:31","","10.1002/9781394172948.ch10","",,,,,,4,2.00,1,4,2,"… The robot-assisted MIG welding process is also used to … structures, providing automated tool path planning [18]. A MATLAB … GH and Ahmed, A review of ‘3D concrete printing’: Materials …","","https://scholar.google.com/scholar?q=related:O1V93uudbXAJ:scholar.google.com/&scioq=%223d+concrete+printing%22+%22path+planning%22+%22robot%22&hl=en&as_sdt=2007&as_ylo=2020&as_yhi=2026"
4,"L Hlinenko, V Fast, Y Yakovenko, R Trach…","Solving Some Graph Problems in Composite 3D Printing Using Spreadsheet Modeling",2023,"Journal of Composites …","mdpi.com","https://www.mdpi.com/2504-477X/7/7/299","https://scholar.google.com/scholar?cites=11935260790029257985&as_sdt=2005&sciodt=2007&hl=en",207,"2026-01-26 18:10:31","HTML","","",,,,,,4,1.33,1,5,3,"… However, the 3D printing of composite materials also has some challenges, such as tool path planning and optimization, material distribution and planning, optimization of printing …","https://www.mdpi.com/2504-477X/7/7/299","https://scholar.google.com/scholar?q=related:AY1X63OQoqUJ:scholar.google.com/&scioq=%223d+concrete+printing%22+%22path+planning%22+%22robot%22&hl=en&as_sdt=2007&as_ylo=2020&as_yhi=2026"
