Cites,Authors,Title,Year,Source,Publisher,ArticleURL,CitesURL,GSRank,QueryDate,Type,DOI,ISSN,CitationURL,Volume,Issue,StartPage,EndPage,ECC,CitesPerYear,CitesPerAuthor,AuthorCount,Age,Abstract,FullTextURL,RelatedURL
16,"SA Prieto, X Xu, B García de Soto","A guide for construction practitioners to integrate robotic systems in their construction applications",2024,"Frontiers in Built Environment","frontiersin.org","https://www.frontiersin.org/journals/built-environment/articles/10.3389/fbuil.2024.1307728/full","https://scholar.google.com/scholar?cites=2761072151059627571&as_sdt=2005&sciodt=2007&hl=en",237,"2026-01-26 18:10:31","HTML","10.3389/fbuil.2024.1307728","",,,,,,16,8.00,5,3,2,"… all elements to design a construction robot from scratch, which … design their own robot based on the application requirements. … and fixed robots for 3D concrete printing applications). …","https://www.frontiersin.org/journals/built-environment/articles/10.3389/fbuil.2024.1307728/full","https://scholar.google.com/scholar?q=related:M_4hG35MUSYJ:scholar.google.com/&scioq=%223d+concrete+printing%22+%22path+planning%22+%22robot%22&hl=en&as_sdt=2007&as_ylo=2020&as_yhi=2026"
0,"MR Yazdi Samadi, R Waspe, C Schlette","Physics-based particle system modeling of shotcrete process for robotic placement",2025,"Construction Robotics","Springer","https://link.springer.com/article/10.1007/s41693-025-00172-y","",238,"2026-01-26 18:10:31","HTML","10.1007/s41693-025-00172-y","",,,,,,0,0.00,0,3,1,"… model presented here—in the robot’s perception and control … inherent to extrusion-based 3D concrete printing—such as the … macro-scale fabrication, robotic path planning, or formwork …","https://link.springer.com/article/10.1007/s41693-025-00172-y","https://scholar.google.com/scholar?q=related:pJN_GAT4yWQJ:scholar.google.com/&scioq=%223d+concrete+printing%22+%22path+planning%22+%22robot%22&hl=en&as_sdt=2007&as_ylo=2020&as_yhi=2026"
22,"J Li, Q Cui, C Pang, P Xu, W Luo, J Li","Integrated vehicle chassis fabricated by wire and arc additive manufacturing: structure generation, printing radian optimisation, and performance prediction",2024,"Virtual and Physical …","Taylor &Francis","https://www.tandfonline.com/doi/abs/10.1080/17452759.2023.2301483%4010.1080/tfocoll.2024.0.issue-Wire-based-Additive-Manufacturing","https://scholar.google.com/scholar?cites=18128564977192535212&as_sdt=2005&sciodt=2007&hl=en",239,"2026-01-26 18:10:31","","10.1080/17452759.2023.2301483%4010.1080/tfocoll.2024.0.issue-Wire-based-Additive-Manufacturing","",,,,,,22,11.00,4,6,2,"… welding torch installed on the KR 150R2700KUKA robot, and an argon conveying system … Grasshopper for digital linkage slicing and printing path planning. The generated SRC file is …","https://www.tandfonline.com/doi/pdf/10.1080/17452759.2023.2301483%4010.1080/tfocoll.2024.0.issue-Wire-based-Additive-Manufacturing","https://scholar.google.com/scholar?q=related:rAQmKcyZlfsJ:scholar.google.com/&scioq=%223d+concrete+printing%22+%22path+planning%22+%22robot%22&hl=en&as_sdt=2007&as_ylo=2020&as_yhi=2026"
40,"K Ren, Y Chew, N Liu, YF Zhang…","Integrated numerical modelling and deep learning for multi-layer cube deposition planning in laser aided additive manufacturing",2021,"Virtual and Physical …","Taylor &Francis","https://www.tandfonline.com/doi/abs/10.1080/17452759.2021.1922714","https://scholar.google.com/scholar?cites=7053485450420550873&as_sdt=2005&sciodt=2007&hl=en",240,"2026-01-26 18:10:31","","10.1080/17452759.2021.1922714","",,,,,,40,8.00,8,5,5,"… computer numerical control (CNC) machine or robot utilised in LAAM make it possible to … surface finishing quality of the extrusion-based 3D concrete printing (Lao et al. Citation2020)…","https://www.tandfonline.com/doi/pdf/10.1080/17452759.2021.1922714","https://scholar.google.com/scholar?q=related:2fyzbKUD42EJ:scholar.google.com/&scioq=%223d+concrete+printing%22+%22path+planning%22+%22robot%22&hl=en&as_sdt=2007&as_ylo=2020&as_yhi=2026"
4,"S Bhooshan","Shape Design of 3D-Concrete-Printed Masonry Structures",2023,"","block.arch.ethz.ch","https://block.arch.ethz.ch/brg/files/Final_manuscript_figures_online_high_corrected%20(1)__1689943408.pdf","https://scholar.google.com/scholar?cites=7586093504500537177&as_sdt=2005&sciodt=2007&hl=en",241,"2026-01-26 18:10:31","PDF","","",,,,,,4,1.33,4,1,3,"… A man and a robot can do much! … of digital concrete by specifically investigating the deep compatibility between design of unreinforced masonry structures and 3D Concrete Printing. …","https://block.arch.ethz.ch/brg/files/Final_manuscript_figures_online_high_corrected%20(1)__1689943408.pdf","https://scholar.google.com/scholar?q=related:WReneNk3R2kJ:scholar.google.com/&scioq=%223d+concrete+printing%22+%22path+planning%22+%22robot%22&hl=en&as_sdt=2007&as_ylo=2020&as_yhi=2026"
4,"V Furlan, F Insero, H Giberti","Robotic FDM for free-form fabrication: evaluating adaptive non-planar slicing with different contour methods",2025,"Rapid Prototyping Journal","emerald.com","https://www.emerald.com/insight/content/doi/10.1108/rpj-03-2024-0109/full/html","https://scholar.google.com/scholar?cites=13575254754613795406&as_sdt=2005&sciodt=2007&hl=en",242,"2026-01-26 18:10:31","HTML","10.1108/rpj-03-2024-0109","",,,,,,4,4.00,1,3,1,"… It saves robot poses from the robot, TCP speeds (V TCP ) … from the PC runtime the robot motion. The primitive motion used is … Each pose is sent one by one to the robot controller filling a …","https://www.emerald.com/insight/content/doi/10.1108/rpj-03-2024-0109/full/html","https://scholar.google.com/scholar?q=related:ThowSEb-ZLwJ:scholar.google.com/&scioq=%223d+concrete+printing%22+%22path+planning%22+%22robot%22&hl=en&as_sdt=2007&as_ylo=2020&as_yhi=2026"
3,"M Palma","Grading Threads. Exploiting Viscous Thread Instability for the additive fabrication of Functionally Graded Structures via sensor-adaptive robotic control",2023,"Architecture, Structures and Construction","Springer","https://link.springer.com/article/10.1007/s44150-023-00089-6","https://scholar.google.com/scholar?cites=6557884655746948611&as_sdt=2005&sciodt=2007&hl=en",243,"2026-01-26 18:10:31","HTML","10.1007/s44150-023-00089-6","",,,,,,3,1.00,3,1,3,"… normal vector necessary to compute a 6 DOF robot pose (a’’) … collision avoidance or path-planning strategies in a similar … of-the-art path-planning libraries and integrated …","https://link.springer.com/article/10.1007/s44150-023-00089-6","https://scholar.google.com/scholar?q=related:Ax7IZ1lJAlsJ:scholar.google.com/&scioq=%223d+concrete+printing%22+%22path+planning%22+%22robot%22&hl=en&as_sdt=2007&as_ylo=2020&as_yhi=2026"
0,"L Whyte","Incorporating synthetic zeolites into 3D printed concrete for carbon capture",,"repository.lboro.ac.uk","","https://repository.lboro.ac.uk/articles/thesis/Incorporating_synthetic_zeolites_into_3D_printed_concrete_for_carbon_capture/28886597","",244,"2026-01-26 18:10:31","","","",,,,,,0,0.00,0,1,,"… The materials used for 3D Concrete Printing are typically high in cement and consequently have significantly more embodied carbon than more than “typical” mortars and concretes. It is …","https://repository.lboro.ac.uk/articles/thesis/Incorporating_synthetic_zeolites_into_3D_printed_concrete_for_carbon_capture/28886597/1/files/54024287.pdf","https://scholar.google.com/scholar?q=related:8YirHfklx48J:scholar.google.com/&scioq=%223d+concrete+printing%22+%22path+planning%22+%22robot%22&hl=en&as_sdt=2007&as_ylo=2020&as_yhi=2026"
1,"İH Tarhan, Y Tarhan","Cultural heritage conservation in digital era: A review of digital twin and 3D printing applications",2025,"Uludağ Üniversitesi Mühendislik Fakültesi …","dergipark.org.tr","https://dergipark.org.tr/en/pub/uumfd/issue/95877/1604638","https://scholar.google.com/scholar?cites=15117412707612605015&as_sdt=2005&sciodt=2007&hl=en",245,"2026-01-26 18:10:31","","","",,,,,,1,1.00,1,2,1,"… A modified algorithm optimized slicing and nozzle path planning, … Robot movements were simulated virtually to ensure … Using a 6-axis Kuka robot with a custom clay extruder, the team …","https://dergipark.org.tr/en/download/article-file/4454963","https://scholar.google.com/scholar?q=related:V7o5GMPWy9EJ:scholar.google.com/&scioq=%223d+concrete+printing%22+%22path+planning%22+%22robot%22&hl=en&as_sdt=2007&as_ylo=2020&as_yhi=2026"
14,"F Raspall, S Araya, M Pazols, E Valenzuela, M Castillo…","Wire Arc Additive Manufacturing for Widespread Architectural Application: A Review Informed by Large-Scale Prototypes",2025,"Buildings","mdpi.com","https://www.mdpi.com/2075-5309/15/6/906","https://scholar.google.com/scholar?cites=13869157809048838110&as_sdt=2005&sciodt=2007&hl=en",246,"2026-01-26 18:10:31","HTML","","",,,,,,14,14.00,2,6,1,"… complex steel structures using a robot-guided gas-shielded metal … into layers and employing parametric robot programming (PRP) to … Path planning was handled via Grasshopper3D, …","https://www.mdpi.com/2075-5309/15/6/906","https://scholar.google.com/scholar?q=related:3t8wnoslecAJ:scholar.google.com/&scioq=%223d+concrete+printing%22+%22path+planning%22+%22robot%22&hl=en&as_sdt=2007&as_ylo=2020&as_yhi=2026"
0,"JC Jimenez Fernandez, A Alonso-Cepeda","BEEYONDERS: Breakthrough Technologies For A Human-Centric, Digitalized And Automated Construction Sector: Challenges And Impact Analysis",,"International Journal of …","researchgate.net","https://www.researchgate.net/profile/Jose-Carlos-Jimenez/publication/397489241_BEEYONDERS_Breakthrough_Technologies_For_A_Human-_Centric_Digitalized_And_Automated_Construction_Sector_Challenges_And_Impact_Analysis/links/6912f68cc900be105cc0c26d/BEEYONDERS-Breakthrough-Technologies-For-A-Human-Centric-Digitalized-And-Automated-Construction-Sector-Challenges-And-Impact-Analysis.pdf","",247,"2026-01-26 18:10:31","PDF","","",,,,,,0,0.00,0,2,,"… To build the map, the robot makes use of the data gathered … the application of 3D concrete printing by focusing on … terrain mapping and adaptive path planning. Onboard sensor fusion …","https://www.researchgate.net/profile/Jose-Carlos-Jimenez/publication/397489241_BEEYONDERS_Breakthrough_Technologies_For_A_Human-_Centric_Digitalized_And_Automated_Construction_Sector_Challenges_And_Impact_Analysis/links/6912f68cc900be105cc0c26d/BEEYONDERS-Breakthrough-Technologies-For-A-Human-Centric-Digitalized-And-Automated-Construction-Sector-Challenges-And-Impact-Analysis.pdf","https://scholar.google.com/scholar?q=related:hPUYdBnvwWUJ:scholar.google.com/&scioq=%223d+concrete+printing%22+%22path+planning%22+%22robot%22&hl=en&as_sdt=2007&as_ylo=2020&as_yhi=2026"
1,"LM Henao-Rios, A Orobio, W Campaña","BIM integration in prefabricated additive construction projects, case study",2026,"Journal of Building Pathology …","Springer","https://link.springer.com/article/10.1007/s41024-025-00678-6","https://scholar.google.com/scholar?cites=12376502591130847333&as_sdt=2005&sciodt=2007&hl=en",248,"2026-01-26 18:10:31","HTML","10.1007/s41024-025-00678-6","",,,,,,1,1.00,0,3,1,"… The workflow also includes simulating the printing work with a Kuka-PRC robot using the … These forms pose new challenges in both modeling and print path planning, which can be …","https://link.springer.com/article/10.1007/s41024-025-00678-6","https://scholar.google.com/scholar?q=related:ZUgOeogrwqsJ:scholar.google.com/&scioq=%223d+concrete+printing%22+%22path+planning%22+%22robot%22&hl=en&as_sdt=2007&as_ylo=2020&as_yhi=2026"
0,"F Setaki","From plastic waste to",2023,"PRINT! ARCHITECTURE","books.google.com","https://books.google.com/books?hl=en&lr=&id=bgXaEAAAQBAJ&oi=fnd&pg=PA158&dq=%223d+concrete+printing%22+%22path+planning%22+%22robot%22&ots=IjkBg8qyfI&sig=5rFSxlow3rW7wDMF_8vMBkBMagk","",249,"2026-01-26 18:10:31","","","",,,,,,0,0.00,0,1,3,"… with a robot system consisting of an industrial robot mounted … The robot they have created can attach itself to the build … to CAD environment for further path planning. 3D scanner in stand-…","","https://scholar.google.com/scholar?q=related:zlziJFxbnsYJ:scholar.google.com/&scioq=%223d+concrete+printing%22+%22path+planning%22+%22robot%22&hl=en&as_sdt=2007&as_ylo=2020&as_yhi=2026"
0,"JS Akmal, N Doosti, M Macarie, K Minet-Lallemand…","Artificial intelligence-aided defect detection and healing in laser-based powder bed fusion",2025,"","aaltodoc.aalto.fi","https://aaltodoc.aalto.fi/bitstreams/1a35687f-58cd-436a-ad1b-c1e65d704764/download","",250,"2026-01-26 18:10:31","PDF","","",,,,,,0,0.00,0,5,1,"… Biochar Particle Size on Printability, Performance and Sustainability of 3D Concrete Printing … 3D concrete printing with coarse aggregate: a study of mechanical properties and CO2 …","https://aaltodoc.aalto.fi/bitstreams/1a35687f-58cd-436a-ad1b-c1e65d704764/download","https://scholar.google.com/scholar?q=related:sEfLEvluTwMJ:scholar.google.com/&scioq=%223d+concrete+printing%22+%22path+planning%22+%22robot%22&hl=en&as_sdt=2007&as_ylo=2020&as_yhi=2026"
0,"JLA Pineda Figueroa","Additive Manufacturing a Review of its Potential to Solve the Housing Challenge in Middle America",2020,"","theseus.fi","https://www.theseus.fi/handle/10024/355813","",251,"2026-01-26 18:10:31","","","",,,,,,0,0.00,0,1,6,"The following thesis aims to understand Additive Manufacturing techniques as a possible solution to the housing challenge in Middle America. To do so, a general overview of the …","https://www.theseus.fi/bitstream/handle/10024/355813/PinedaFigueroa_JoseLuis.pdf?sequence=2","https://scholar.google.com/scholar?q=related:tU10Bpu27wAJ:scholar.google.com/&scioq=%223d+concrete+printing%22+%22path+planning%22+%22robot%22&hl=en&as_sdt=2007&as_ylo=2020&as_yhi=2026"
96,"J Cheng, S Yu, R Wang, Q Ge","Digital light processing based multimaterial 3D printing: challenges, solutions and perspectives",2024,"International Journal of Extreme …","iopscience.iop.org","https://iopscience.iop.org/article/10.1088/2631-7990/ad4a2c/meta","https://scholar.google.com/scholar?cites=9065101230891324952&as_sdt=2005&sciodt=2007&hl=en",252,"2026-01-26 18:10:31","HTML","10.1088/2631-7990/ad4a2c","",,,,,,96,48.00,24,4,2,"… By allocating sections of piezoactive phases as the sensing element and utilizing its direct piezoelectric effects through 3D embedded electrodes, the robot attains proprioceptive …","https://iopscience.iop.org/article/10.1088/2631-7990/ad4a2c/meta","https://scholar.google.com/scholar?q=related:GNY7YIq1zX0J:scholar.google.com/&scioq=%223d+concrete+printing%22+%22path+planning%22+%22robot%22&hl=en&as_sdt=2007&as_ylo=2020&as_yhi=2026"
0,"D Luo, L Yu","From Factory to Site-Designing",2021,"… Cities: Design, Construction, Operation and Future …","books.google.com","https://books.google.com/books?hl=en&lr=&id=tdQREAAAQBAJ&oi=fnd&pg=PA86&dq=%223d+concrete+printing%22+%22path+planning%22+%22robot%22&ots=DubiI5KtJz&sig=RV-dNCN-164ecFCEzcQeOe5OpnM","",253,"2026-01-26 18:10:31","","","",,,,,,0,0.00,0,2,5,"… In our view, our present circumstances make it ripe for connecting robot technology with … of the brick garden was optimised while path-planning for the robots, ensuring clearance for the …","","https://scholar.google.com/scholar?q=related:yh4rhH3Va4wJ:scholar.google.com/&scioq=%223d+concrete+printing%22+%22path+planning%22+%22robot%22&hl=en&as_sdt=2007&as_ylo=2020&as_yhi=2026"
0,"J Liang, Z Zeng, P Wang, Z Wang, Y Zhou…","A Case Study of Rapid 3d Reproduction of a Bridge in a Realistic Scene",,"Available at SSRN …","papers.ssrn.com","https://papers.ssrn.com/sol3/papers.cfm?abstract_id=5093609","",254,"2026-01-26 18:10:31","","","",,,,,,0,0.00,0,6,,"… robot arm. The second layer of polyurethane mixture ejected by the atomizing nozzle 378 … and printing path planning. Finally, the path code is input into the robot control 620 …","https://papers.ssrn.com/sol3/Delivery.cfm?abstractid=5093609","https://scholar.google.com/scholar?q=related:yYKUFogoCywJ:scholar.google.com/&scioq=%223d+concrete+printing%22+%22path+planning%22+%22robot%22&hl=en&as_sdt=2007&as_ylo=2020&as_yhi=2026"
110,"M Zarebidoki, JS Dhupia, W Xu","A review of cable-driven parallel robots: Typical configurations, analysis techniques, and control methods",2022,"IEEE Robotics &Automation …","ieeexplore.ieee.org","https://ieeexplore.ieee.org/abstract/document/9745192/","https://scholar.google.com/scholar?cites=614680666525524045&as_sdt=2005&sciodt=2007&hl=en",255,"2026-01-26 18:10:31","","","",,,,,,110,27.50,37,3,4,"… may exist where the robot is in … path planning is studied in the literature to tackle this problem. In [33], a homotropy-signature augmented graph [Figure 10(a)] was used for path planning …","https://ieeexplore.ieee.org/iel7/100/4600619/09745192.pdf","https://scholar.google.com/scholar?q=related:TeCNOs_IhwgJ:scholar.google.com/&scioq=%223d+concrete+printing%22+%22path+planning%22+%22robot%22&hl=en&as_sdt=2007&as_ylo=2020&as_yhi=2026"
203,"L Chen, X Yao, P Xu, SK Moon, G Bi","Rapid surface defect identification for additive manufacturing with in-situ point cloud processing and machine learning",2021,"Virtual and Physical …","Taylor &Francis","https://www.tandfonline.com/doi/abs/10.1080/17452759.2020.1832695","https://scholar.google.com/scholar?cites=11954038244017599884&as_sdt=2005&sciodt=2007&hl=en",256,"2026-01-26 18:10:31","","10.1080/17452759.2020.1832695","",,,,,,203,40.60,41,5,5,"… , the robot driver node continuously receives the robot joint data from the robot controller through the ‘robot state’ socket… The robot driver node also sends controlling signals through the ‘…","https://www.tandfonline.com/doi/pdf/10.1080/17452759.2020.1832695","https://scholar.google.com/scholar?q=related:jHUannJG5aUJ:scholar.google.com/&scioq=%223d+concrete+printing%22+%22path+planning%22+%22robot%22&hl=en&as_sdt=2007&as_ylo=2020&as_yhi=2026"
1,"Z Al-Nabulsi","Characterization of steel components printed using WAAM technology",2021,"","wrap.warwick.ac.uk","https://wrap.warwick.ac.uk/id/eprint/170971/","https://scholar.google.com/scholar?cites=7455212839740199004&as_sdt=2005&sciodt=2007&hl=en",257,"2026-01-26 18:10:31","","","",,,,,,1,0.20,1,1,5,"This thesis presents the outcomes of research for structural engineering exploitation of 3D printed steel components produced by using Wire Arc Additive Manufacturing (WAAM) …","https://wrap.warwick.ac.uk/id/eprint/170971/1/WRAP_Theses_AlNabuli_2021.pdf","https://scholar.google.com/scholar?q=related:XFClDZQ8dmcJ:scholar.google.com/&scioq=%223d+concrete+printing%22+%22path+planning%22+%22robot%22&hl=en&as_sdt=2007&as_ylo=2020&as_yhi=2026"
0,"H Nasir, FM Yop Zain","The suitability of implementing 3D printing construction towards Malaysian construction industry",2023,"e-Proceeding of 6th Undergraduate Seminar …","ir.uitm.edu.my","https://ir.uitm.edu.my/id/eprint/93313/","",258,"2026-01-26 18:10:31","","","",,,,,,0,0.00,0,2,3,"3D printing will change the construction industry's routine. 3D printing uses a computer to layer liquid substance to form a building's shape. Thus, this research is aimed to determine the …","https://ir.uitm.edu.my/id/eprint/93313/1/93313.pdf","https://scholar.google.com/scholar?q=related:3OBY91ylyYsJ:scholar.google.com/&scioq=%223d+concrete+printing%22+%22path+planning%22+%22robot%22&hl=en&as_sdt=2007&as_ylo=2020&as_yhi=2026"
0,"J Mendoza-Martínez, F Jiménez-Ponce…","Scaling Exoskeleton Prototype for Gait Analysis",2025,"… Conference on Motion …","Springer","https://link.springer.com/chapter/10.1007/978-3-032-15271-8_11","",259,"2026-01-26 18:10:31","","10.1007/978-3-032-15271-8_11","",,,,,,0,0.00,0,3,1,"… A study on collision-free path-planning for cable-driven … In addition, algorithms were designed to avoid both robot–… robotics, particularly in 3D concrete printing. Tho and Thinh designed …","","https://scholar.google.com/scholar?q=related:Z3KR74cnXmwJ:scholar.google.com/&scioq=%223d+concrete+printing%22+%22path+planning%22+%22robot%22&hl=en&as_sdt=2007&as_ylo=2020&as_yhi=2026"
4,"D Mourtzis, P Kaimasidis, J Angelopoulos…","Design and development of a g-code generator for cnc machine tools based on augmented reality (AR)",2022,"… Conference on Product …","Springer","https://link.springer.com/chapter/10.1007/978-3-031-25182-5_37","https://scholar.google.com/scholar?cites=1488326065087524383&as_sdt=2005&sciodt=2007&hl=en",260,"2026-01-26 18:10:31","","10.1007/978-3-031-25182-5_37","",,,,,,4,1.00,1,4,4,"… plug-in is focused on the simulation of 3D concrete printing constructions as presented in [10]. … Furthermore, AR has been investigated for interacting with robots for path planning [14], …","https://inria.hal.science/hal-05420931/file/538048_1_En_37_Chapter.pdf","https://scholar.google.com/scholar?q=related:Hy5_s6uYpxQJ:scholar.google.com/&scioq=%223d+concrete+printing%22+%22path+planning%22+%22robot%22&hl=en&as_sdt=2007&as_ylo=2020&as_yhi=2026"
0,"S Li, X Yang","6-DOF Outdoor High-Load Robot for Solar Panel Array Installation: Deformation Compensation, Inverse Kinematics and Decoupling Control",2025,"2025 6th International Conference on Internet of …","ieeexplore.ieee.org","https://ieeexplore.ieee.org/abstract/document/11212705/","",261,"2026-01-26 18:10:31","","","",,,,,,0,0.00,0,2,1,"… This paper develops a 6-DOF high-load robot designed for … to 0.5 m demonstrate that the robot attains operational accuracy … payload of the SPA installation robot is 1.2 t, exceeding this …","https://ieeexplore.ieee.org/iel8/11211527/11212649/11212705.pdf","https://scholar.google.com/scholar?q=related:uo7fXXTel6gJ:scholar.google.com/&scioq=%223d+concrete+printing%22+%22path+planning%22+%22robot%22&hl=en&as_sdt=2007&as_ylo=2020&as_yhi=2026"
7,"OJ Oladunni, CKM Lee, ID Ibrahim…","Advances in sustainable additive manufacturing: a systematic review for construction industry to mitigate greenhouse gas emissions",2025,"Frontiers in Built …","frontiersin.org","https://www.frontiersin.org/journals/built-environment/articles/10.3389/fbuil.2025.1535626/full","https://scholar.google.com/scholar?cites=15103481811459234792&as_sdt=2005&sciodt=2007&hl=en",262,"2026-01-26 18:10:31","HTML","10.3389/fbuil.2025.1535626","",,,,,,7,7.00,2,4,1,"… Following available sources on the seven types of AM, there are two main techniques (applicable to any other technique) for rapid development of a large-scale 3D concrete printing (…","https://www.frontiersin.org/journals/built-environment/articles/10.3389/fbuil.2025.1535626/full","https://scholar.google.com/scholar?q=related:6NuZk69YmtEJ:scholar.google.com/&scioq=%223d+concrete+printing%22+%22path+planning%22+%22robot%22&hl=en&as_sdt=2007&as_ylo=2020&as_yhi=2026"
0,"B Elkhapery","Sequencing Automated Multi-Agent Wall Construction-UAV Case Scenario",2023,"","search.proquest.com","https://search.proquest.com/openview/c68ad0754006aa18a7d728d52bbe8c9b/1?pq-origsite=gscholar&cbl=18750&diss=y","",263,"2026-01-26 18:10:31","BOOK","","",,,,,,0,0.00,0,1,3,"… AM or 3D concrete printing falls under construction 4.0 pillars. One of AM’s current concrete … 6-axis robot, held on a mobile platform driven by a hydraulic caterpillar track. The robot arm …","https://search.proquest.com/openview/c68ad0754006aa18a7d728d52bbe8c9b/1?pq-origsite=gscholar&cbl=18750&diss=y","https://scholar.google.com/scholar?q=related:0o1jQF6hWgYJ:scholar.google.com/&scioq=%223d+concrete+printing%22+%22path+planning%22+%22robot%22&hl=en&as_sdt=2007&as_ylo=2020&as_yhi=2026"
3,"G Garcés","Advances in Human-Robot Collaboration (HRC) in Construction 5.0 for Building Construction: A Bibliometric and Systematic Literature Review",2025,"J. Inf. Technol. Constr","itcon.org","https://itcon.org/papers/2025_50-ITcon-SI-Garces.pdf","https://scholar.google.com/scholar?cites=8269971202186355831&as_sdt=2005&sciodt=2007&hl=en",264,"2026-01-26 18:10:31","PDF","","",,,,,,3,3.00,3,1,1,"… This systematic review analysed the academic literature on human-robot collaboration, … only those directly relevant to human-robot collaboration in the building construction phase, …","https://itcon.org/papers/2025_50-ITcon-SI-Garces.pdf","https://scholar.google.com/scholar?q=related:dyQHAf7WxHIJ:scholar.google.com/&scioq=%223d+concrete+printing%22+%22path+planning%22+%22robot%22&hl=en&as_sdt=2007&as_ylo=2020&as_yhi=2026"
0,"S Masoumi, A Masoumi","A Review of Additive Manufacturing Effects on Architecture and Construction Industries.",2024,"International Journal on …","search.ebscohost.com","https://search.ebscohost.com/login.aspx?direct=true&profile=ehost&scope=site&authtype=crawler&jrnl=22812881&AN=177051864&h=Kn7sBN0JpzfgalN0xgEHl8PbPdmwef9X%2BgFILgYSZOdGlUCuOyfJv%2FVCBO3PedJwjHH99eoW2uD0ddudcqBdxA%3D%3D&crl=c","",265,"2026-01-26 18:10:31","","","",,,,,,0,0.00,0,2,2,"… Another important issue is 3D-concrete printing, which is being used in manufacturing concrete structures and even in commercial buildings, which have been introduced in this review …","","https://scholar.google.com/scholar?q=related:py9ct229AksJ:scholar.google.com/&scioq=%223d+concrete+printing%22+%22path+planning%22+%22robot%22&hl=en&as_sdt=2007&as_ylo=2020&as_yhi=2026"
0,"DH Nguyen, NT Bui","Trajectory Tracking of Cable-Driven Parallel Robot via a Hybrid Structure of Type-2 Fuzzy Controllers and Sliding Mode Control Under Disturbances and Pulley …",2025,"IEEE Access","ieeexplore.ieee.org","https://ieeexplore.ieee.org/abstract/document/11224530/","",266,"2026-01-26 18:10:31","","","",,,,,,0,0.00,0,2,1,"… An interval type-2 fuzzy control method also designs a path planning scheme that considers … cable-driven parallel robot with applications in 3D concrete printing,’’ Appl. Sci., vol. 11, no. …","https://ieeexplore.ieee.org/iel8/6287639/10820123/11224530.pdf","https://scholar.google.com/scholar?q=related:p6F8_hZKChYJ:scholar.google.com/&scioq=%223d+concrete+printing%22+%22path+planning%22+%22robot%22&hl=en&as_sdt=2007&as_ylo=2020&as_yhi=2026"
